{
  "schema_version": "2.0.0",
  "id": "simulate-queue",
  "slug": "simulate-queue",
  "title": "Queue from Two Stacks",
  "difficulty": { "label": "easy", "score": 350 },
  "topics": ["stacks", "queues"],
  "status": "published",
  "revision": 1,
  "estimated_minutes": 25,
  "provenance": { "author": "SAIT DSA", "license": "CC-BY-4.0", "source": "original" },
  "statement": "Process q operations on a queue: ENQ x pushes x, DEQ pops front and prints it (or NONE if empty).",
  "io_format": {
    "mode": "stdin_stdout",
    "input_description": "Line 1: q. Next q lines: ENQ x or DEQ.",
    "output_description": "One line per DEQ result."
  },
  "constraints": ["1 <= q <= 10^4"],
  "examples": [
    {
      "input": "4\nENQ 1\nENQ 2\nDEQ\nDEQ",
      "output": "1\n2"
    }
  ],
  "execution": {
    "time_limit_ms": 2000,
    "memory_limit_kb": 262144,
    "comparison": "trimmed_lines",
    "languages": ["python"]
  },
  "test_cases": [
    { "id": "pub-1", "is_public": true, "input": "4\nENQ 1\nENQ 2\nDEQ\nDEQ", "expected_output": "1\n2" },
    { "id": "hid-1", "is_public": false, "input": "2\nDEQ\nENQ 3", "expected_output": "NONE" }
  ],
  "hints": [{ "order": 1, "text": "collections.deque supports O(1) ends." }],
  "editorial": "Use deque for enqueue/dequeue.",
  "complexity": { "time": "O(q)", "space": "O(q)" },
  "reference_solutions": {
    "python": "import sys\nfrom collections import deque\nlines = sys.stdin.read().strip().splitlines()\nq = int(lines[0])\nd = deque()\nout = []\nfor i in range(1, 1+q):\n    parts = lines[i].split()\n    if parts[0] == 'ENQ':\n        d.append(int(parts[1]))\n    else:\n        out.append(str(d.popleft()) if d else 'NONE')\nprint('\\n'.join(out))\n"
  }
}
