{
  "schema_version": "2.0.0",
  "id": "max-subarray",
  "slug": "max-subarray",
  "title": "Maximum Subarray Sum",
  "difficulty": { "label": "intermediate", "score": 600 },
  "topics": ["arrays", "dynamic-programming"],
  "status": "published",
  "revision": 1,
  "estimated_minutes": 30,
  "provenance": { "author": "SAIT DSA", "license": "CC-BY-4.0", "source": "original" },
  "statement": "Print the maximum sum of any contiguous subarray.",
  "io_format": {
    "mode": "stdin_stdout",
    "input_description": "Line 1: n. Line 2: n integers.",
    "output_description": "Maximum subarray sum."
  },
  "constraints": ["1 <= n <= 10^5"],
  "examples": [{ "input": "9\n-2 1 -3 4 -1 2 1 -5 4", "output": "6" }],
  "execution": {
    "time_limit_ms": 2000,
    "memory_limit_kb": 262144,
    "comparison": "trimmed",
    "languages": ["python"]
  },
  "test_cases": [
    { "id": "pub-1", "is_public": true, "input": "9\n-2 1 -3 4 -1 2 1 -5 4", "expected_output": "6" },
    { "id": "hid-1", "is_public": false, "input": "1\n-1000", "expected_output": "-1000" }
  ],
  "hints": [{ "order": 1, "text": "Kadane: best ending here vs start fresh." }],
  "complexity": { "time": "O(n)", "space": "O(1)" },
  "reference_solutions": {
    "python": "import sys\ndata = sys.stdin.read().strip().split()\nn = int(data[0])\nnums = list(map(int, data[1:1+n]))\nbest = cur = nums[0]\nfor x in nums[1:]:\n    cur = max(x, cur+x)\n    best = max(best, cur)\nprint(best)\n"
  }
}
