{
  "schema_version": "2.0.0",
  "id": "two-sum",
  "slug": "two-sum",
  "title": "Two Sum Indices",
  "difficulty": { "label": "easy", "score": 300 },
  "topics": ["arrays", "hashing"],
  "prerequisites": ["array-sum"],
  "status": "published",
  "revision": 1,
  "estimated_minutes": 25,
  "provenance": { "author": "SAIT DSA", "license": "CC-BY-4.0", "source": "original" },
  "statement": "Given n, a list of n integers, and target t, print two distinct indices (0-based) whose values sum to t. Exactly one solution exists. Print smaller index first.",
  "io_format": {
    "mode": "stdin_stdout",
    "input_description": "Line 1: n. Line 2: n integers. Line 3: target t.",
    "output_description": "Two integers separated by a space."
  },
  "constraints": ["2 <= n <= 20000"],
  "examples": [
    { "input": "4\n2 7 11 15\n9", "output": "0 1", "explanation": "2+7=9" }
  ],
  "execution": {
    "time_limit_ms": 2000,
    "memory_limit_kb": 262144,
    "comparison": "trimmed",
    "languages": ["python", "cpp", "java"]
  },
  "test_cases": [
    { "id": "pub-1", "is_public": true, "input": "4\n2 7 11 15\n9", "expected_output": "0 1" },
    { "id": "pub-2", "is_public": true, "input": "3\n3 2 4\n6", "expected_output": "1 2" },
    { "id": "hid-1", "is_public": false, "input": "2\n3 3\n6", "expected_output": "0 1" }
  ],
  "hints": [
    { "order": 1, "text": "Brute force works for small n." },
    { "order": 2, "text": "Store value→index in a hash map while scanning." }
  ],
  "editorial": "One-pass hash map complement lookup.",
  "complexity": { "time": "O(n)", "space": "O(n)" },
  "reference_solutions": {
    "python": "import sys\ndata = sys.stdin.read().strip().split()\nn = int(data[0])\nnums = list(map(int, data[1:1+n]))\nt = int(data[1+n])\nseen = {}\nfor i, v in enumerate(nums):\n    if t - v in seen:\n        a, b = seen[t-v], i\n        print(min(a,b), max(a,b))\n        break\n    seen[v] = i\n"
  }
}
