{
  "schema_version": "2.0.0",
  "id": "sorted-two-sum",
  "slug": "sorted-two-sum",
  "title": "Two Sum in Sorted Array",
  "difficulty": { "label": "intermediate", "score": 520 },
  "topics": ["two-pointers", "arrays"],
  "status": "published",
  "revision": 1,
  "estimated_minutes": 25,
  "provenance": { "author": "SAIT DSA", "license": "CC-BY-4.0", "source": "original" },
  "statement": "Given sorted distinct integers and target t, print 1-based indices i j (i < j) with values summing to t, or -1 -1 if none.",
  "io_format": {
    "mode": "stdin_stdout",
    "input_description": "Line 1: n. Line 2: sorted ints. Line 3: t.",
    "output_description": "Two integers."
  },
  "constraints": ["2 <= n <= 10^5"],
  "examples": [{ "input": "4\n1 2 3 4\n7", "output": "3 4" }],
  "execution": {
    "time_limit_ms": 1000,
    "memory_limit_kb": 131072,
    "comparison": "trimmed",
    "languages": ["python"]
  },
  "test_cases": [
    { "id": "pub-1", "is_public": true, "input": "4\n1 2 3 4\n7", "expected_output": "3 4" },
    { "id": "hid-1", "is_public": false, "input": "3\n1 2 3\n10", "expected_output": "-1 -1" }
  ],
  "hints": [{ "order": 1, "text": "Two pointers at both ends." }],
  "editorial": "Shrink range based on sum vs target.",
  "complexity": { "time": "O(n)", "space": "O(1)" },
  "reference_solutions": {
    "python": "import sys\ndata = sys.stdin.read().strip().split()\nn = int(data[0])\narr = list(map(int, data[1:1+n]))\nt = int(data[1+n])\nl, r = 0, n-1\nwhile l < r:\n    s = arr[l]+arr[r]\n    if s == t:\n        print(l+1, r+1)\n        exit()\n    if s < t:\n        l += 1\n    else:\n        r -= 1\nprint(-1, -1)\n"
  }
}
